{
  "$schema": "http://json-schema.org/draft-07/schema#",
  "title": "GameContext",
  "type": "object",
  "required": [
    "choices",
    "segments"
  ],
  "properties": {
    "character": {
      "anyOf": [
        {
          "$ref": "#/definitions/Character"
        },
        {
          "type": "null"
        }
      ]
    },
    "choices": {
      "type": "object",
      "additionalProperties": {
        "$ref": "#/definitions/Choice"
      }
    },
    "save_data": {
      "anyOf": [
        {
          "$ref": "#/definitions/SaveData"
        },
        {
          "type": "null"
        }
      ]
    },
    "segments": {
      "type": "object",
      "additionalProperties": {
        "$ref": "#/definitions/StorySegment"
      }
    }
  },
  "definitions": {
    "Character": {
      "type": "object",
      "required": [
        "surname"
      ],
      "properties": {
        "family_name": {
          "type": [
            "string",
            "null"
          ]
        },
        "nickname": {
          "type": [
            "string",
            "null"
          ]
        },
        "surname": {
          "type": "string"
        }
      }
    },
    "Choice": {
      "type": "object",
      "required": [
        "consequence",
        "id",
        "text"
      ],
      "properties": {
        "consequence": {
          "type": "string"
        },
        "id": {
          "type": "string"
        },
        "next_segment": {
          "type": [
            "string",
            "null"
          ]
        },
        "text": {
          "type": "string"
        }
      }
    },
    "SaveData": {
      "type": "object",
      "required": [
        "choices",
        "segments"
      ],
      "properties": {
        "choices": {
          "type": "array",
          "items": {
            "$ref": "#/definitions/Choice"
          }
        },
        "segments": {
          "type": "array",
          "items": {
            "$ref": "#/definitions/StorySegment"
          }
        }
      }
    },
    "StorySegment": {
      "type": "object",
      "required": [
        "choices",
        "id",
        "narrative"
      ],
      "properties": {
        "choices": {
          "type": "array",
          "items": {
            "type": "string"
          }
        },
        "id": {
          "type": "string"
        },
        "narrative": {
          "type": "string"
        }
      }
    }
  }
}
